id,nama,rating,no_telepon,harga,total_pengunjung,alamat,kordinat,keterangan
1,Artotel Suites Bianti Yogyakarta,"5,0 ", 08112837799,625000,,"Jl. Urip Sumoharjo No.37, Klitren, Kec. Gondokusuman, Kota Yogyakarta, Daerah Istimewa Yogyakarta 55222","-7.782655534201323, 110.38190546790418","Set among shops in the city center and offering views of Mount Merapi, this polished hotel is 18 minutes' walk from Lempuyangan train station, 3 km from eateries along Malioboro Street and 5 km from the Palace of Yogyakarta. Chic rooms feature Wi-Fi, TVs and minibars, as well as floor-to-ceiling windows, and tea and coffeemakers. Suites have sitting areas and/or mountain views; an upgraded suite provides a separate living/dining room with a pull-out sofa. Amenities include a restaurant and a rooftop lounge/bar, plus a spa, an outdoor pool and a gym. Breakfast is available."
2,The Phoenix Hotel Yogyakarta - MGallery Collection,"4,5",0274566617,735390,,"Jl. Jend. Sudirman No.9, Cokrodiningratan, Kec. Jetis, Kota Yogyakarta, Daerah Istimewa Yogyakarta 55233","-7.782368072882206, 110.36852501265078","Set in a colonial building dating from 1918, this refined hotel is 2.1 km from the shops and restaurants of Jalan Malioboro, and 4 km from the 18th-century palace of Kraton Ngayogyakarta Hadiningrat. Featuring traditional Indonesian decor, the elegant rooms offer free Wi-Fi and flat-screen TVs. Upgraded rooms add coffeemakers and minibars; suites include separate living rooms. Cribs are available, and room service is offered. Parking is free. Other facilities include a cosy wine bar, an open-air bar with a fountain, and a genteel, international restaurant with chandeliers. There’s also a spa, a gym, and an outdoor pool in an inner courtyard."
3,Hotel New Saphir Yogyakarta,"3,5",0274566222,398160,,"Jl. Laksda Adisucipto No.38, Demangan, Kec. Gondokusuman, Kota Yogyakarta, Daerah Istimewa Yogyakarta 55221","-7.783321134572196, 110.3914155390688","This chic, palm-tree fronted hotel with views of Mount Merapi is 2 km from Lempuyangan train station and 4 km from the shopping of Jalan Malioboro. The upscale rooms and suites feature free Wi-Fi, flat-screens, and tea and coffeemakers. Some have sofas and/or mountain or pool views, and suites add extra bathrooms and living rooms with TVs; some have dining areas. An upgraded suite has a dining room and a pantry, as well as a complimentary butler service. Room service is offered 24/7. There's free continental breakfast and parking. Other amenities include a restaurant, a gym and an outdoor pool, as well as a bar, a tennis court and a ballroom."
4,Lafayette Boutique Hotel Yogyakarta,"4,5",02742924777,649366,,"Manggung, Caturtunggal, Kec. Depok, Kabupaten Sleman, Daerah Istimewa Yogyakarta 55281","-7.759268574181231, 110.38734472557458","In a bustling commercial area, this upscale, stately hotel is 6 km from the Jalan Malioboro shopping area and 8 km from Adisucipto International Airport. Ornate rooms offer free Wi-Fi, smart TVs, minibars and sitting areas; some add views of Mount Merapi and lounge access. A 1-bedroom penthouse suite adds a kitchenette, city views and a soaking tub. There's a stylish restaurant, along with a chic rooftop bar that features panoramic views of the city. Other amenities include a gym, and an outdoor infinity pool with mountain views. Event space is available."
5,Grand Mercure Yogyakarta Adi Sucipto,"4,5",02742924000,532784,,"Jl. Laksda Adisucipto No.80, Demangan Baru, Caturtunggal, Sleman, Kota Yogyakarta, Daerah Istimewa Yogyakarta 55281","-7.783529869615401, 110.39236054584215","Set in a commercial area and offering views of the surrounding mountains, this upmarket hotel is 5 km from both Maguwo train station and Jalan Malioboro, a bustling road with shops, street performers and food stalls. Chic rooms feature free Wi-Fi, flat-screen TVs and minifridges; some come with balconies, mountain views and/or access to a private lounge. Kids age 12 and under (up to 2 per room) stay at no charge with a parent. Room service is available 24/7. Parking and a shuttle to Jalan Malioboro are free. There's also an airy international restaurant and a cozy cocktail lounge, along with a gym and an outdoor pool."
6,Grand Keisha Yogyakarta,"4,5",02745012200,426465,,"Jl. Affandi No.9, Gejayan, Condongcatur, Kec. Depok, Kabupaten Sleman, Daerah Istimewa Yogyakarta 55283","-7.758822174533065, 110.39599013936483","Set in a commercial area, this relaxed hotel is 5 km from Jogja Bay, 6 km from the Monument Yogya Kembali and 4 km from the Affandi Museum. Stylish rooms feature free Wi-Fi and flat-screen TVs, plus minibars, and tea and coffeemaking facilities. They also have bathrooms with rainfall showers; suites add living areas. Room service is available. There's an elegant restaurant serving regional cuisine, plus 2 lounges, including a warm 9th-floor lounge with city views. Additional amenities include an outdoor pool, a gym and a ballroom."
7,THE 1O1 Yogyakarta Tugu,"4,5",02742920101,546623,,"Jl. Margo Utomo No.103, Gowongan, Kec. Jetis, Kota Yogyakarta, Daerah Istimewa Yogyakarta 55232","-7.783731809214222, 110.36634407031661","Surrounded by city center shops and dining, this trendy hotel with views of the Mount Merapi is 12 minutes' walk from both Stasiun Yogyakarta train station and Jalan Malioboro, a bustling shopping street. Bright rooms provide free Wi-Fi, flat-screen TVs and balconies, plus tea and coffeemaking facilities. Upgraded rooms add mountain views or pool access; suites have sitting areas. Room service is available 24/7. Parking is free. There's an airy cafe with floor-to-ceiling windows that has seating next to an outdoor pool, plus a relaxed lounge bar with a terrace. Other amenities include a gym and massage services. Meeting rooms are available."
8,Nueve Malioboro Hotel Yogyakarta,"4,0 ",0274562420,178385,,"Mataram St No.9, Suryatmajan, Danurejan, Yogyakarta City, Special Region of Yogyakarta 55213","-7.795818393844755, 110.36887526221052","A 7-minute walk from open-air shops and eateries along Jalan Malioboro, this laid-back hotel is 2 km from Kraton Ngayogyakarta Hadiningrat, an 18th-century palace complex and royal residence, and 9 km from Adisucipto International Airport. Unfussy rooms feature flat-screen TVs and free Wi-Fi, as well as en suite, shower-only bathrooms. Some offer tea and coffeemakers, and safes. Upgraded rooms add sitting areas and minibars. Room service is available 24/7. Along with parking, a breakfast buffet is complimentary. Other amenities include a relaxed restaurant, an outdoor pool and meeting facilities, plus bicycle rentals."
9,Artotel Yogyakarta,"4,5",02746000333,427554,,"Jalan Kaliurang KM. 5,6 No.14, Manggung, Caturtunggal, Kabupaten Sleman, Daerah Istimewa Yogyakarta 55281","-7.756432970876404, 110.3822591189231","On a commercial street, this trendy, art-filled hotel with an indoor slide is 6 km from the Museum Affandi and 9 km from Adisucipto International Airport. Featuring vibrant wall art, the relaxed, modern rooms have free Wi-Fi, flat-screen TVs, minifridges and coffeemakers. Upgraded rooms add living areas. Room service is available 24/7. Amenities include an informal 24-hour restaurant, a rooftop bar and an outdoor pool."
10,Hotel Citradream Yogyakarta,"4,0 ",02746429123,252220,,"Jl. A.M. Sangaji No.28, Cokrodiningratan, Kec. Jetis, Kota Yogyakarta, Daerah Istimewa Yogyakarta 55233","-7.779803129874829, 110.36766580647142","This laid-back hotel in a colorful building is 2 km from the lively Jalan Malioboro shopping district, and 4 km from Keraton Ngayogyakarta Hadiningrat, an 18th-century royal palace. Simply furnished rooms come with complimentary Wi-Fi, flat-screen TVs and safes. Complimentary perks include parking, and hot breakfast served in a vibrant dining room. Meeting space is available."
11,Abadi Hotel Malioboro Yogyakarta,"4,0 ",081804186036,429715,,"Jl. Ps. Kembang No.49, Sosromenduran, Gedong Tengen, Kota Yogyakarta, Daerah Istimewa Yogyakarta 55271","-7.7896975706096745, 110.36334059555996","A minute's walk from Stasiun Yogyakarta, this informal hotel is also an 11-minute walk from Jalan Malioboro shopping district and 3 km from The Palace of Yogyakarta. Relaxed rooms offer flat-screen TVs, in addition to tea and coffeemaking facilities. Suites add sitting rooms. Wi-Fi and room service are available. A 24-hour coffee shop serves both European and local cuisine. There's also an outdoor pool, a spa and banquet facilities."
12,Jambuluwuk Malioboro Yogyakarta Hotel,"4,0 ",0274585655,499380,,"Jl. Gajah Mada No.67, Purwokinanti, Pakualaman, Kota Yogyakarta, Daerah Istimewa Yogyakarta 55166","-7.796896691324248, 110.37261063912776","Set in the downtown area, this modern hotel is a 14-minute walk from the Jalan Malioboro shopping district and the Fort Vredeburg Museum, and 9 km from Adisucipto International Airport. The sophisticated rooms provide minibars, free Wi-Fi and satellite TV, plus tea and coffeemakers. Upgraded rooms and suites add city views, dining areas and/or separate living rooms. Room service is available 24/7. Airport transfers are free. There's a full-service spa, a gym, and a pool surrounded by tropical greenery. Other amenities include a coffee shop, an open-air bistro and a lounge with live music, along with a karaoke lounge."
13,H Boutique Hotel Jogjakarta,"4,0 ",02746429742,293523,,"Jl. Prof. Herman Yohanes No.1, Terban, Kec. Gondokusuman, Kota Yogyakarta, Daerah Istimewa Yogyakarta 55223","-7.780732773879161, 110.37942896029121","Surrounded by shops and eateries, this understated hotel in the city center is 5 km from the 18th-century Palace of Yogyakarta and a 16-minute walk from Lempuyangan train station. Streamlined rooms and suites feature free Wi-Fi and flat-screen TVs; some add sitting areas and minifridges. Amenities include a bar and a restaurant with a terrace. There's also meeting and event space. Parking is available."
14,Grand Kangen Hotel Urip Sumoharjo,"4,5",02744469999,321691,,"Jl. Urip Sumoharjo No.137, Klitren, Kec. Gondokusuman, Kota Yogyakarta, Daerah Istimewa Yogyakarta 55222","-7.782379655486281, 110.38685292413977","On a main road in an area with shops and eateries, this informal hotel is 2 km from Tugu, an 1889 landmark monument. It's 3 km from Yogyakarta train station and 5 km from the Palace of Yogyakarta. The unpretentious rooms have Wi-Fi, flat-screen TVs and minifridges, plus tea and coffeemaking facilities. Suites add separate living rooms. Amenities include an indoor pool and a spa, as well as a warmly decorated, casual restaurant and a cozy cafe. Breakfast is available."
15,Horaios Malioboro Hotel,"4,0 ",0274557070,208612,,"Jl. Gowongan Kidul No.57, Sosromenduran, Gedong Tengen, Kota Yogyakarta, Daerah Istimewa Yogyakarta 55271","-7.786679419612421, 110.36356230674681","An 11-minute walk from the shops and restaurants on bustling Jalan Malioboro, this informal hotel is 4 km from Keraton Ngayogyakarta Hadiningrat, an 18th-century royal palace, and 9 km from Adisucipto International Airport. Polished rooms have free Wi-Fi, flat-screen TVs and coffeemakers; some offer city views. Suites add balconies, minifridges and separate living areas. Family suites sleep up to 4. Room service is available 24/7. Parking is complimentary. There’s a casual coffee shop and a restaurant, along with a courtyard patio. An airport shuttle, bike rentals and massage treatments are offered for a fee."
16,Hotel Adilla Syariah Ambarukmo,"3,5",02744932100,173264,,"Jl. Nogorojo No.15, Ambarukmo, Caturtunggal, Kec. Depok, Kabupaten Bantul, Daerah Istimewa Yogyakarta 55198","-7.7861430034442245, 110.3993152520004",NaN
17,Malioboro Prime Hotel,"4,0 ",02742922999,342000,,"Jl. Ps. Kembang No.9, Sosromenduran, Gedong Tengen, Kota Yogyakarta, Daerah Istimewa Yogyakarta 55271","-7.789793884154045, 110.36519536441774","Across the road from Yogyakarta train station, this laid-back hotel is a 4-minute walk from the street performances and casual eateries along Jalan Malioboro, and 3 km from the Palace of Yogyakarta. Streamlined rooms with tile floors feature flat-screen TVs, Wi-Fi and kettles; some have sitting areas. There's also room service. Amenities include a restaurant, a business center and meeting space. Breakfast and parking are available."
18,Yogyakarta Marriott Hotel,"4,5 ",02746000888,1162416,,"Jl. Ring Road Utara, Kaliwaru, Condongcatur, Kec. Depok, Kabupaten Sleman, Daerah Istimewa Yogyakarta 55283","-7.761683019744237, 110.39842536441776","In a modern building lined with palm trees, this elegant hotel is 7 km from the Jogja Expo Center and 8 km from Yogyakarta Adisucipto International Airport. Stylish rooms with city or pool views include free Wi-Fi, flat-screens and minifridges, as well as tea and coffeemakers, and marble bathrooms; some offer sofabeds. Upgraded rooms provide access to a lounge serving breakfast and snacks. Suites add separate living rooms. Room service is available 24/7. Parking is complimentary. There are 3 restaurants; 1 offers Mediterranean cuisine and outdoor seating. Other amenities include an indoor/outdoor pool, along with a a spa and a fitness center."
19,Ibis Yogyakarta Malioboro Hotel,"4,5",0274516974,444233,,"Jl. Malioboro No.52-58, Suryatmajan, Kec. Danurejan, Kota Yogyakarta, Daerah Istimewa Yogyakarta 55001","-7.7929863455848984, 110.36627852024027","This budget hotel in Yogyakarta's central business district is a minute's walk from the shops on lively Jalan Malioboro and 1.6 km from Kraton Ngayogyakarta Hadiningrat, an 18th-century royal residence. The simple, modern rooms feature free Wi-Fi, satellite TV, and tea and coffeemaking facilities, as well as minifridges. Room service is available. Amenities include a modern restaurant serving international cuisine, and a bar offering drinks and snacks. There's also an outdoor pool and a fitness room."
20,Hotel Dafam Fortuna Malioboro,"4,0 ",02746429888,390023,,"Jl. Malioboro Jl. Dagen No.60, Sosromenduran, Gedong Tengen, Kota Yogyakarta, Daerah Istimewa Yogyakarta 55271","-7.793148669790788, 110.36291408822846","This stylish hotel in a colorful building is a 6-minute walk from high-end shopping at Jalan Malioboro, and 3 km each from the 18th-century Palace of Yogyakarta and the royal gardens at Taman Sari. Bright, informal rooms offer free Wi-Fi, flat-screen TVs and coffeemakers. A top-floor suite features a separate living area and direct pool access. There's a chic restaurant and a spa, as well as a rooftop terrace with a pool and a bar."
21,Hotel Unisi Yogyakarta,"4,0 ",02742924999,323086,,"Jl. Ps. Kembang No.42, Sosromenduran, Gedong Tengen, Kota Yogyakarta, Daerah Istimewa Yogyakarta 55271","-7.789924528964478, 110.36377814907478","On a bustling street in the city center, this casual budget hotel is an 8-minute walk from both Jogjakarta train station and Jalan Malioboro, a major shopping street. Featuring photographic wall murals, the cozy rooms come with free Wi-Fi, flat-screen TVs, and tea and coffeemaking facilities. Room service is available 24/7. There's a relaxed restaurant."
22,Hotel Tentrem Yogyakarta,"4,5",02746415555,1446717,,"Jl. P. Mangkubumi No.72A, Cokrodiningratan, Kec. Jetis, Kota Yogyakarta, Daerah Istimewa Yogyakarta 55233","-7.77360801036089, 110.36841849140322","Among shops and restaurants, this lavish hotel is 2.9 km from the markets on buzzy Jalan Malioboro, and 5 km from Keraton Ngayogyakarta Hadiningrat palace. Plush, modern rooms offer free Wi-Fi and flat-screen TVs, plus minibars, and tea and coffeemakers. Upgraded rooms have balconies; studios and 1- to 2-bedroom suites add living areas and/or whirlpool tubs. An upgraded suite offers a kitchenette, a powder room and 24/7 butler service. A breakfast buffet and parking are complimentary. Other amenities include 2 upscale restaurants and a polished lounge, plus an outdoor pool with a poolside bar. There’s also a spa, a gym and a boutique."
23,Grand Inna Malioboro,"4,0 ",0274566353,567719,,"Jl. Malioboro No.60, Suryatmajan, Kec. Danurejan, Kota Yogyakarta, Daerah Istimewa Yogyakarta 55213","-7.790545359124181, 110.36693470674632","This stately hotel is 2 km from 18th-century Kraton Ngayogyakarta Hadiningrat palace, 5 km from shopping at Ambarrukmo Plaza and a 15-minute walk from Fort Vredeburg Museum, a former colonial fortress. The elegant rooms and suites feature free Wi-Fi, flat-screen TVs and minifridges. Room service is also available. Amenities include 3 restaurants and a lounge, as well as a spa, an outdoor pool with a terrace, and 18 meeting rooms."
24,Porta by The Ambarrukmo,"5,0 ",02745022777,454445,,"Jl. Colombo Yogyakarta No.7, RT.01/RW.01, Samirono, Caturtunggal, Kec. Depok, Kabupaten Sleman, Daerah Istimewa Yogyakarta 55281","-7.776544281650621, 110.38230977791055","Set along a main road, this refined hotel with a glass exterior is 2 km from the striking Affandi Museum and 4 km from Beringharjo Market, dating from 1758. It's also 7 km from Adisucipto International Airport. Relaxed rooms with sleek furnishings offer Wi-Fi, flat-screen TVs, and tea and coffeemaking facilities, plus minibars and desks. Upgraded rooms add microwaves and daybeds. Room service is 24/7. There's a wood-paneled restaurant, a chic bar/lounge and a cafe, as well as an outdoor pool, hot tubs and a sauna/steam room. There's also a kids' club. Parking and breakfast are available."
25,HOM Premiere Timoho,"4,5",0274547171,283433,,"Jl. Ipda Tut Harsono No.24, Muja Muju, Kec. Umbulharjo, Kota Yogyakarta, Daerah Istimewa Yogyakarta 55165","-7.798319563368921, 110.39274564907477","Set in an area with restaurants, this informal hotel is 4 km from shops along Jalan Malioboro, 15 minutes on foot from the Gembira Loka Zoo and 7 km from Adisucipto International Airport. Unassuming rooms come with Wi-Fi and flat-screen TVs. Upgraded rooms add sitting areas. There's 24-hour room service. Amenities include a restaurant and an airy lobby lounge with floor-to-ceiling windows, as well as a courtyard pool. Parking and breakfast are available."
26,3C Familia Residence,"4,2",0274562638,NaN,,"Jalan Mayjend Bambang Sugeng No.949, Bausasran, Kec. Danurejan, Kota Yogyakarta, Daerah Istimewa Yogyakarta 55211","-7.796221262222834, 110.37532116256742",NaN
27,Abrisam Shareeah Family Homestay,"4,1",087839299080,949999,,"59F8+RV3, jln cepakasari, Brontokusuman, Mergangsan, Yogyakarta City, Special Region of Yogyakarta 55143","-7.825356067374318, 110.36717249325366",NaN
28,Adhisthana Hotel,"4,0",0274413888,323513,,"Jl. Prawirotaman 2 No.613, Brontokusuman, Kec. Mergangsan, Kota Yogyakarta, Daerah Istimewa Yogyakarta 55153","-7.819640755329321, 110.37218216441788","Featuring an eclectic facade made from upcycled shutters and windows, this hip hotel is 2 km from the De Mata Trick Eye Museum and 4 km from Gembira Loka Zoo. Featuring rustic country-style decor, the bright single-sex dorms offer Wi-Fi, reading lamps and en suite bathrooms. Private rooms have flat-screens, and tea and coffeemakers; suites add minibars and sofas. Amenities include a simple guest lounge, and a trendy cafe/bar with a terrace, as well as an internal courtyard with an outdoor pool and lounge chairs. Breakfast is available."
29,Aloha Hotel,"4,8",0274419876,228015,,"MG III/573B, Jl. Prawirotaman, Brontokusuman, Kec. Mergangsan, Kota Yogyakarta, Daerah Istimewa Yogyakarta 55153","-7.818449912529353, 110.37217874907478",NaN
30,Arjuna 31 Homestay,"4,5",08112652333,99778,,"Jl. Arjuna No.31, Wirobrajan, Kota Yogyakarta, Daerah Istimewa Yogyakarta 55252","-7.804386355046464, 110.34806874907478","On a leafy residential street, this cozy homestay is 3 km from trains at Stasiun Jogjakarta and 4 km from the lively shopping area of Jalan Malioboro. The straightforward mixed-gender dorms provide bunk beds and lockers. Private rooms are also available. All quarters offer shared bathrooms and complimentary Wi-Fi. Coffee and tea are included. Motorbike rentals are available."
31,Ayola Tasneem Convention Hotel,"4,0",NaN,246225,,"Jl. Brigjend. Katamso-IredaKeparakan, Mergangsan, Yogyakarta, Indonesia, 55152","-7.808151798101397, 110.37113753558211",NaN
32,Best City Hotel,"4,0",02744333996,224456,,"Jl. Tentara Pelajar No.44, Bumijo, Kec. Jetis, Kota Yogyakarta, Daerah Istimewa Yogyakarta 55231","-7.783270155067768, 110.36094993558211",NaN
33,Cavinton Hotel Yogyakarta by Tritama Hospitality,"4,0",02746429988,388189,,"Jl. Letjen Suprapto No.1, Ngampilan, Kota Yogyakarta, Daerah Istimewa Yogyakarta 55261","-7.800566746395892, 110.35605109325368","This modern, upscale hotel is 1 km from the 18th-century Kraton of Yogyakarta palace complex and 2 km from Jalan Malioboro shopping district. Warm rooms and suites feature flat-screen TVs, free Wi-Fi and minifridges, plus tea and coffeemaking facilities. Some rooms have city views. Suites add separate living rooms, balconies and safes. Room service is available 24/7. Parking is complimentary. Indonesian and Western cuisine is served in an airy restaurant and in a top floor dining room with 360 degree views. There's also a relaxed coffee shop, a pool and a children's play area, plus a gym, a ballroom and a business center."
34,De Laxston by Azana,"3,5",0274552552,294820,,"Jl. Urip Sumoharjo No.139 A, Klitren, Kec. Gondokusuman, Kota Yogyakarta, Daerah Istimewa Yogyakarta 55222","-7.782786274902553, 110.38717169325365","Set along a bustling commercial street, this casual hotel is 3 km from Yogyakarta train station, 4 km from Gembira Loka Zoo and 5 km from the 18th-century Palace of Yogyakarta. Relaxed rooms come with free Wi-Fi, flat-screen TVs and sitting areas, as well as tea and coffeemaking facilities. Suites add minifridges and separate living space. Room service is provided 24/7. Complimentary amenities include parking, and breakfast served in an airy restaurant. There’s also an indoor pool, a modest lobby lounge, and meeting and event space."
35,Gloria Amanda Hotel,"2,5",0274565286,245370,,"Jl. Sosrowijayan Jl. Sosrowijayan GT I No.195, Sosromenduran, Gedong Tengen, Kota Yogyakarta, Daerah Istimewa Yogyakarta 55271","-7.790764320854552, 110.36337357791052","A 6-minute walk from the bustling shops and restaurants of Jalan Malioboro, this straightforward hotel is a 5-minute walk from the Yogyakarta train station and 10-minute walk from the Pasar Pathuk farmer's market. Basic rooms offer free Wi-Fi, cold-water bathrooms, fans and TVs. Upgraded rooms add flat-screen TVs, hot water bathrooms and air-conditioning. Some upgraded rooms also have extra beds, minibars, and tea and coffeemaking facilities. Complimentary amenities include parking and breakfast. There's also an outdoor pool. Massage services are available."
36,Grand Senyum Hotel,"4,5",0274566306,513216,,"Jl. Pangeran Diponegoro No.27, Gowongan, Kec. Jetis, Kota Yogyakarta, Daerah Istimewa Yogyakarta 55232","-7.783114145120513, 110.36535710674632","In a bustling shopping and dining area, this polished hotel is a 14-minute walk from Yogyakarta train station, and 4 km from both Sari Garden and the Fort Vredeburg Museum. Elegant rooms provide TVs, and tea and coffeemaking facilities. Upgraded rooms add sitting areas; suites have separate living rooms. Amenities include a rooftop terrace with a pool, plus a restaurant, and an airy lobby lounge with floor-to-ceiling windows. Bike rentals, event space and Wi-Fi are also offered. Breakfast is available, with a floating in-pool option."
37,Hasian Malioboro Motel,"3,0",02742920870,227713,,"Jl. Perwakilan No.26, Suryatmajan, Kec. Danurejan, Kota Yogyakarta, Daerah Istimewa Yogyakarta 55213","-7.7924819792078015, 110.3671308644179",NaN
38,Hotel GRAND ROSELA Yogyakarta,"3,0",0274419191,315714,,"Jl. Prawirotaman No.28, Brontokusuman, Kec. Mergangsan, Kota Yogyakarta, Daerah Istimewa Yogyakarta 55153","-7.819214691105671, 110.37126672208944","On a bustling street lined with eateries, this modest hotel is 5 km from Jogjakarta train station. It's 3 km from both Fort Vredeburg Museum and Traditional Market Bringharjo. Bright, relaxed rooms offer TVs, air-conditioning and minifridges. All feature tea and coffeemaking facilities, as well as hot and cold water. Some have seating areas. A buffet-style restaurant features international cuisine and offers both al fresco and outdoor patio dining. Other amenities include an outdoor pool, a garden and event space."
39,Madani Syariah Hotel,"1,5",0274581378,NaN,,"Jl. Cantel Baru II No.1 A, Muja Muju, Kec. Umbulharjo, Kota Yogyakarta, Daerah Istimewa Yogyakarta 55165","-7.7951795835331685, 110.38772722208942",NaN
40,Hotel Mataram Malioboro,"3,5",0274581721,412072,,"Jl. Ps. Kembang No.61, Sosromenduran, Gedong Tengen, Kota Yogyakarta, Daerah Istimewa Yogyakarta 55271","-7.78984450962976, 110.36267534907475",NaN
41,Sans Hotel Heryon Yogyakarta,"4,5",02180629666,220961,,"Jl. Menteri Supeno No.28D, Sorosutan, Kec. Umbulharjo, Kota Yogyakarta, Daerah Istimewa Yogyakarta 55162","-7.816228644011223, 110.37777645092524",NaN
42,Hotel Museum Batik,"4,2",0274541766,263247,,"Jl. Doktor Sutomo No.13A, Bausasran, Kec. Danurejan, Kota Yogyakarta, Daerah Istimewa Yogyakarta 55211","-7.795340802375508, 110.37727003558211",NaN
43,Hotel Neo Malioboro by ASTON,"4,0",0274511999,555902,,"Jl. Ps. Kembang No.21, Sosromenduran, Gedong Tengen, Kota Yogyakarta, Daerah Istimewa Yogyakarta 55271","-7.789809628898857, 110.36459743558213","A 2-minute walk from both Yogyakarta train station and the shops and stalls of vibrant Jalan Malioboro street, this modern hotel is 2 km from the Keraton Ngayogyakarta Hadiningrat royal palace. Bright, relaxed rooms feature free Wi-Fi, flat-screen TVs and minibars, as well as tea and coffeemaking facilities. Upgraded rooms add living areas with sofabeds. Room service is offered. There’s an informal restaurant; breakfast is extra. Other amenities include a rooftop bar and lounge, a spa, an outdoor pool and a kids’ pool. Parking is available."
